{
  "version": "1.0",
  "timestamp": "2025-07-10T19:30:17.900Z",
  "ship": {
    "Ship Name": "Ogrika Sunpaa",
    "Manufacturer": "Ogrika",
    "Spec": "Freight",
    "Class": 5,
    "cargo_capacity": 156019,
    "fuel_capacity": 64594,
    "ammo_capacity": 8750,
    "asteroid_mining_food_rate": 0.064194,
    "asteroid_mining_ammo_rate": 0.008114,
    "asteroid_mining_rate": 0.741755,
    "subwarp_speed": 0.001155,
    "warp_speed": 0.033,
    "max_warp_distance": 11.5,
    "warp_cool_down": 300,
    "warp_fuel_consumption": 1114.29,
    "subwarp_fuel_consumption": 306.12,
    "planet_exit_fuel": 306,
    "scan_cool_down": 828,
    "sduPerScan": 560,
    "scan_cost": 2828,
    "required_crew": 19,
    "passenger_capacity": 15,
    "respawnTime": 209,
    "ship_size": 118,
    "warp_lane_speed": 0.07,
    "warp_lane_fee": 125,
    "warp_spool_time": 30,
    "loading_rate": 2340.3,
    "scan_power": 520,
    "hit_points": 4569,
    "shield_points": 3162,
    "shield_recharge_rate": 14,
    "shield_break_delay": 61,
    "damage": 271.9,
    "max_ap": 271.9,
    "ap_recharge_time": 15.12,
    "repair_cost": 99120,
    "repair_rate": 664,
    "repair_ability": 55,
    "repair_efficiency": 98,
    "repair_cooldown": 105,
    "loot_rate": 1560.2,
    "ship_size_value": 1675000,
    "lp_value\r": 31500,
    "xp_value": 300,
    "damage_kinetic": 0,
    "damage_energy": 0,
    "damage_emp": 0,
    "damage_superchill": 0,
    "damage_shockwave": 0,
    "damage_graygoo": 0,
    "damage_heat": 0,
    "counter_decoy": 0,
    "counter_energy_capacitor": 0,
    "counter_fire_suppressor": 0,
    "counter_flare": 0,
    "counter_healing_nanobots": 0,
    "counter_mine": 0,
    "counter_negative_rem_plating": 0,
    "counter_warming_plates": 0,
    "counter_faraday_shielding": 0,
    "damage_bomb": 0,
    "crit_chance": 0,
    "crit_multiplier": 0,
    "damage_range": 0,
    "stealth_power": 0,
    "missile_power": 0,
    "missile_capacity": 0,
    "hit_chance": 0,
    "hit_points_range": 0,
    "shield_points_range": 0,
    "stealth_power_range": 0,
    "missile_power_range": 0,
    "id": 42
  },
  "shipIdentifier": "ogrika-sunpaa-ogrika",
  "configurations": [
    {
      "name": "Default",
      "components": {
        "Ship Component": {
          "Mining Rig": []
        },
        "Ship Module": {},
        "Ship Weapons": {},
        "Countermeasures": {},
        "Missiles": {},
        "Bombs": {}
      }
    },
    {
      "name": "Tier One",
      "components": {
        "Ship Component": {
          "Power Core": [
            114427
          ],
          "Warp Drive": [
            114537
          ],
          "Subwarp Engine": [
            114482
          ],
          "Maneuvering Thrusters": [
            114372
          ],
          "Shield Generator": [
            114317
          ],
          "Heat Sink": [
            28
          ],
          "Scanner Array": [
            114592
          ],
          "Tractor Beam": [
            114647
          ],
          "Hull Reinforcement": [
            114757
          ],
          "Missile Bay": [
            115075,
            115075
          ],
          "Mining Rig": []
        },
        "Ship Module": {
          "Cargo Module": [
            114152,
            114152,
            114152,
            114152
          ],
          "Fuel Module": [
            114207,
            114207
          ]
        },
        "Ship Weapons": {
          "Energy": [
            77284,
            77284,
            77284,
            77284
          ],
          "Heat": [],
          "EMP": [
            77752,
            77752,
            77752,
            77752
          ]
        },
        "Countermeasures": {
          "Energy Capacitor": [
            115317
          ],
          "Faraday Shielding": [
            115314
          ],
          "Flare": [
            115299
          ]
        },
        "Missiles": {
          "Photon": [
            113407,
            113407
          ]
        },
        "Bombs": {}
      },
      "locked": true
    },
    {
      "name": "Tier Two",
      "components": {
        "Ship Component": {
          "Power Core": [
            114428
          ],
          "Warp Drive": [
            114538
          ],
          "Subwarp Engine": [
            114483
          ],
          "Maneuvering Thrusters": [
            114373
          ],
          "Shield Generator": [
            114318
          ],
          "Heat Sink": [
            29
          ],
          "Scanner Array": [
            114593
          ],
          "Tractor Beam": [
            114648
          ],
          "Hull Reinforcement": [
            114758
          ],
          "Missile Bay": [
            115076,
            115076
          ],
          "Mining Rig": []
        },
        "Ship Module": {
          "Cargo Module": [
            114153,
            114153,
            114153,
            114153
          ],
          "Fuel Module": [
            114208,
            114208
          ]
        },
        "Ship Weapons": {
          "Energy": [
            77345,
            77345,
            77345,
            77345
          ],
          "Heat": [],
          "EMP": [
            77813,
            77813,
            77813,
            77813
          ]
        },
        "Countermeasures": {
          "Energy Capacitor": [
            115519
          ],
          "Faraday Shielding": [
            115516
          ],
          "Flare": [
            115501
          ]
        },
        "Missiles": {
          "Photon": [
            116044,
            116044
          ]
        },
        "Bombs": {}
      },
      "locked": true
    },
    {
      "name": "Tier Three",
      "components": {
        "Ship Component": {
          "Power Core": [
            114429
          ],
          "Warp Drive": [
            114539
          ],
          "Subwarp Engine": [
            114484
          ],
          "Maneuvering Thrusters": [
            114374
          ],
          "Shield Generator": [
            114319
          ],
          "Heat Sink": [
            30
          ],
          "Scanner Array": [
            114594
          ],
          "Tractor Beam": [
            114649
          ],
          "Hull Reinforcement": [
            114759
          ],
          "Missile Bay": [
            115077,
            115077
          ],
          "Mining Rig": []
        },
        "Ship Module": {
          "Cargo Module": [
            114154,
            114154,
            114154,
            114154
          ],
          "Fuel Module": [
            114209,
            114209
          ]
        },
        "Ship Weapons": {
          "Energy": [
            77406,
            77406,
            77406,
            77406
          ],
          "Heat": [],
          "EMP": [
            77874,
            77874,
            77874,
            77874
          ]
        },
        "Countermeasures": {
          "Energy Capacitor": [
            115620
          ],
          "Faraday Shielding": [
            115617
          ],
          "Flare": [
            115602
          ]
        },
        "Missiles": {
          "Photon": [
            116125,
            116125
          ]
        },
        "Bombs": {}
      },
      "locked": true
    },
    {
      "name": "Tier Four",
      "components": {
        "Ship Component": {
          "Power Core": [
            114430
          ],
          "Warp Drive": [
            114540
          ],
          "Subwarp Engine": [
            114485
          ],
          "Maneuvering Thrusters": [
            114375
          ],
          "Shield Generator": [
            114320
          ],
          "Heat Sink": [
            31
          ],
          "Scanner Array": [
            114595
          ],
          "Tractor Beam": [
            114650
          ],
          "Hull Reinforcement": [
            114760
          ],
          "Missile Bay": [
            115078,
            115078
          ],
          "Mining Rig": []
        },
        "Ship Module": {
          "Cargo Module": [
            114155,
            114155,
            114155,
            114155
          ],
          "Fuel Module": [
            114210,
            114210
          ]
        },
        "Ship Weapons": {
          "Energy": [
            77467,
            77467,
            77467,
            77467
          ],
          "Heat": [],
          "EMP": [
            77935,
            77935,
            77935,
            77935
          ]
        },
        "Countermeasures": {
          "Energy Capacitor": [
            115721
          ],
          "Faraday Shielding": [
            115718
          ],
          "Flare": [
            115703
          ]
        },
        "Missiles": {
          "Photon": [
            116206,
            116206
          ]
        },
        "Bombs": {}
      },
      "locked": true
    },
    {
      "name": "Tier Five",
      "components": {
        "Ship Component": {
          "Power Core": [
            114431
          ],
          "Warp Drive": [
            114541
          ],
          "Subwarp Engine": [
            114486
          ],
          "Maneuvering Thrusters": [
            114376
          ],
          "Shield Generator": [
            114321
          ],
          "Heat Sink": [
            32
          ],
          "Scanner Array": [
            114596
          ],
          "Tractor Beam": [
            114651
          ],
          "Hull Reinforcement": [
            114761
          ],
          "Missile Bay": [
            115079,
            115079
          ],
          "Mining Rig": []
        },
        "Ship Module": {
          "Cargo Module": [
            114156,
            114156,
            114156,
            114156
          ],
          "Fuel Module": [
            114211,
            114211
          ]